{
  "schema_version": "1.0",
  "matrix_version": "1.0",
  "project": "k-slide",
  "change_id": "CHG-16 / KSA-38",
  "product_subject": {
    "commit_sha": "23669bacb0392aecc009ae19c7b8c645f1d8c7dd",
    "tree_oid": "e049fcc0e5d245630c1a47e1ec08d30f6419d6c2"
  },
  "change_span": {
    "change_base_sha": "af5836540304b424289bedbe57a87dbb5d02763f",
    "change_base_tree_oid": "f099c39d4665dde2e323108c4ed2ad9122a636a5",
    "commit_count": 152,
    "changed_path_count": 229,
    "changed_path_coverage": [
      {
        "path": ".codex-fabric/audit.json",
        "historical": false,
        "coverage_type": "NON_PRODUCT_PATH_CLASSIFICATION",
        "trace_ids": [],
        "classification": "AUDIT_EVIDENCE",
        "reason": "Committed historical candidate-side audit or qualification evidence at the immutable subject; not adopted as a current KSA-38 receipt."
      },
      {
        "path": ".codex-fabric/ksa36/candidate-evidence.json",
        "historical": false,
        "coverage_type": "NON_PRODUCT_PATH_CLASSIFICATION",
        "trace_ids": [],
        "classification": "AUDIT_EVIDENCE",
        "reason": "Committed historical candidate-side audit or qualification evidence at the immutable subject; not adopted as a current KSA-38 receipt."
      },
      {
        "path": ".codex-fabric/ksa36/py311-measure.json",
        "historical": false,
        "coverage_type": "NON_PRODUCT_PATH_CLASSIFICATION",
        "trace_ids": [],
        "classification": "AUDIT_EVIDENCE",
        "reason": "Committed historical candidate-side audit or qualification evidence at the immutable subject; not adopted as a current KSA-38 receipt."
      },
      {
        "path": ".codex-fabric/ksa36/py312-measure.json",
        "historical": false,
        "coverage_type": "NON_PRODUCT_PATH_CLASSIFICATION",
        "trace_ids": [],
        "classification": "AUDIT_EVIDENCE",
        "reason": "Committed historical candidate-side audit or qualification evidence at the immutable subject; not adopted as a current KSA-38 receipt."
      },
      {
        "path": ".codex-fabric/ksa37/candidate-evidence.json",
        "historical": false,
        "coverage_type": "NON_PRODUCT_PATH_CLASSIFICATION",
        "trace_ids": [],
        "classification": "AUDIT_EVIDENCE",
        "reason": "Committed historical candidate-side audit or qualification evidence at the immutable subject; not adopted as a current KSA-38 receipt."
      },
      {
        "path": ".github/CODEOWNERS",
        "historical": false,
        "coverage_type": "REQUIREMENT_ROW",
        "trace_ids": [
          "KSA38-TR-027"
        ],
        "classification": null,
        "reason": ""
      },
      {
        "path": ".github/workflows/k-slide-governance.yml",
        "historical": false,
        "coverage_type": "REQUIREMENT_ROW",
        "trace_ids": [
          "KSA38-TR-027"
        ],
        "classification": null,
        "reason": ""
      },
      {
        "path": ".github/workflows/k-slide-phase32.yml",
        "historical": false,
        "coverage_type": "REQUIREMENT_ROW",
        "trace_ids": [
          "KSA38-TR-027"
        ],
        "classification": null,
        "reason": ""
      },
      {
        "path": ".github/workflows/k-slide-security.yml",
        "historical": false,
        "coverage_type": "REQUIREMENT_ROW",
        "trace_ids": [
          "KSA38-TR-028"
        ],
        "classification": null,
        "reason": ""
      },
      {
        "path": ".opencode/agents/k-slide.md",
        "historical": false,
        "coverage_type": "REQUIREMENT_ROW",
        "trace_ids": [
          "KSA38-TR-001"
        ],
        "classification": null,
        "reason": ""
      },
      {
        "path": ".opencode/commands/k-slide-continue.md",
        "historical": false,
        "coverage_type": "REQUIREMENT_ROW",
        "trace_ids": [
          "KSA38-TR-001"
        ],
        "classification": null,
        "reason": ""
      },
      {
        "path": ".opencode/commands/k-slide-help.md",
        "historical": false,
        "coverage_type": "REQUIREMENT_ROW",
        "trace_ids": [
          "KSA38-TR-001"
        ],
        "classification": null,
        "reason": ""
      },
      {
        "path": ".opencode/commands/k-slide-safe.md",
        "historical": true,
        "coverage_type": "NON_PRODUCT_PATH_CLASSIFICATION",
        "trace_ids": [],
        "classification": "MIGRATION_COMPATIBILITY",
        "reason": "Retired duplicate command surface; the canonical employee entrypoint remains /k-slide."
      },
      {
        "path": ".opencode/commands/k-slide-strict.md",
        "historical": true,
        "coverage_type": "NON_PRODUCT_PATH_CLASSIFICATION",
        "trace_ids": [],
        "classification": "MIGRATION_COMPATIBILITY",
        "reason": "Retired duplicate command surface; the canonical employee entrypoint remains /k-slide."
      },
      {
        "path": ".opencode/commands/k-slide.md",
        "historical": false,
        "coverage_type": "REQUIREMENT_ROW",
        "trace_ids": [
          "KSA38-TR-001"
        ],
        "classification": null,
        "reason": ""
      },
      {
        "path": ".opencode/internal/lib/k-slide-access-key.ts",
        "historical": false,
        "coverage_type": "REQUIREMENT_ROW",
        "trace_ids": [
          "KSA38-TR-011"
        ],
        "classification": null,
        "reason": ""
      },
      {
        "path": ".opencode/plugin/k-slide-host.ts",
        "historical": false,
        "coverage_type": "REQUIREMENT_ROW",
        "trace_ids": [
          "KSA38-TR-001"
        ],
        "classification": null,
        "reason": ""
      },
      {
        "path": ".opencode/skills/k-slide/SKILL.md",
        "historical": false,
        "coverage_type": "REQUIREMENT_ROW",
        "trace_ids": [
          "KSA38-TR-001"
        ],
        "classification": null,
        "reason": ""
      },
      {
        "path": ".opencode/skills/k-slide/bin/prepare_run.sh",
        "historical": false,
        "coverage_type": "REQUIREMENT_ROW",
        "trace_ids": [
          "KSA38-TR-001"
        ],
        "classification": null,
        "reason": ""
      },
      {
        "path": ".opencode/skills/k-slide/references/troubleshooting.md",
        "historical": false,
        "coverage_type": "REQUIREMENT_ROW",
        "trace_ids": [
          "KSA38-TR-001"
        ],
        "classification": null,
        "reason": ""
      },
      {
        "path": ".opencode/tools/kslide.ts",
        "historical": false,
        "coverage_type": "REQUIREMENT_ROW",
        "trace_ids": [
          "KSA38-TR-001"
        ],
        "classification": null,
        "reason": ""
      },
      {
        "path": "DEVELOPMENT_NOTES.md",
        "historical": false,
        "coverage_type": "NON_PRODUCT_PATH_CLASSIFICATION",
        "trace_ids": [],
        "classification": "DOCUMENTATION",
        "reason": "Documentation or architecture record; it explains the product contract but is not executable product behavior."
      },
      {
        "path": "IMPLEMENTATION_STATUS.md",
        "historical": false,
        "coverage_type": "NON_PRODUCT_PATH_CLASSIFICATION",
        "trace_ids": [],
        "classification": "DOCUMENTATION",
        "reason": "Documentation or architecture record; it explains the product contract but is not executable product behavior."
      },
      {
        "path": "README.md",
        "historical": false,
        "coverage_type": "NON_PRODUCT_PATH_CLASSIFICATION",
        "trace_ids": [],
        "classification": "DOCUMENTATION",
        "reason": "Documentation or architecture record; it explains the product contract but is not executable product behavior."
      },
      {
        "path": "SOURCE_PROVENANCE.md",
        "historical": false,
        "coverage_type": "NON_PRODUCT_PATH_CLASSIFICATION",
        "trace_ids": [],
        "classification": "DOCUMENTATION",
        "reason": "Documentation or architecture record; it explains the product contract but is not executable product behavior."
      },
      {
        "path": "constraints-production.txt",
        "historical": false,
        "coverage_type": "REQUIREMENT_ROW",
        "trace_ids": [
          "KSA38-TR-004"
        ],
        "classification": null,
        "reason": ""
      },
      {
        "path": "deploy/README.md",
        "historical": false,
        "coverage_type": "NON_PRODUCT_PATH_CLASSIFICATION",
        "trace_ids": [],
        "classification": "DOCUMENTATION",
        "reason": "Documentation or architecture record; it explains the product contract but is not executable product behavior."
      },
      {
        "path": "deploy/opencode-bootstrap.example.json",
        "historical": false,
        "coverage_type": "REQUIREMENT_ROW",
        "trace_ids": [
          "KSA38-TR-001"
        ],
        "classification": null,
        "reason": ""
      },
      {
        "path": "deploy/production-profile.example.json",
        "historical": false,
        "coverage_type": "REQUIREMENT_ROW",
        "trace_ids": [
          "KSA38-TR-004",
          "KSA38-TR-007"
        ],
        "classification": null,
        "reason": ""
      },
      {
        "path": "deploy/runtime/Dockerfile",
        "historical": false,
        "coverage_type": "REQUIREMENT_ROW",
        "trace_ids": [
          "KSA38-TR-004"
        ],
        "classification": null,
        "reason": ""
      },
      {
        "path": "deploy/runtime/ocr-context/.keep",
        "historical": false,
        "coverage_type": "REQUIREMENT_ROW",
        "trace_ids": [
          "KSA38-TR-004"
        ],
        "classification": null,
        "reason": ""
      },
      {
        "path": "deploy/runtime/production-dependency-inventory.json",
        "historical": false,
        "coverage_type": "REQUIREMENT_ROW",
        "trace_ids": [
          "KSA38-TR-004"
        ],
        "classification": null,